{"schema_version":"1.0","id":"decision-001","decision":"Use DuckDB for local analytical staging in the sample workflow.","decided_on":"2026-08-12","context":"Fast local analytical processing is required.","rationale":"Columnar local SQL fits the workload and is bundled offline.","alternatives":["SQLite"],"constraints":["No target-side downloads"],"evidence_ids":["fact-001"],"supersedes":[],"superseded_by":null}
